2025-12-04 22:46:22,706 - INFO - Logging to: /data/local/software/dsistuido/connectometry_results/connectometry_batch_20251204_224622.log
2025-12-04 22:46:22,731 - INFO - ✓ DSI Studio validated: /data/local/software/dsi-studio/dsi_studio
2025-12-04 22:46:22,732 - INFO - Starting batch processing: 1 batch(es) selected
2025-12-04 22:46:22,732 - INFO - 
################################################################################
2025-12-04 22:46:22,732 - INFO - BATCH 1/1: full_parameter_sweep
2025-12-04 22:46:22,732 - INFO - Description: Nested sweep of effect size (0.2-0.4) and length threshold (20-80)
2025-12-04 22:46:22,732 - INFO - ################################################################################

2025-12-04 22:46:22,733 - INFO - Generated 25 parameter combination(s)
2025-12-04 22:46:22,733 - INFO - Running with 4 parallel workers
2025-12-04 22:46:22,743 - INFO - 
================================================================================
2025-12-04 22:46:22,743 - INFO - 
================================================================================
2025-12-04 22:46:22,743 - INFO - Analysis 2/25: qa_0.2_30_10000
2025-12-04 22:46:22,744 - INFO - 
================================================================================
2025-12-04 22:46:22,744 - INFO - Analysis 1/25: qa_0.2_20_10000
2025-12-04 22:46:22,744 - INFO - ================================================================================
2025-12-04 22:46:22,744 - INFO - Analysis 3/25: qa_0.2_40_10000
2025-12-04 22:46:22,745 - INFO - ================================================================================
2025-12-04 22:46:22,745 - INFO - Parameters: {
  "source": "/data/local/dsi_crea/dsi_crea/Daten/session1.qa.db.fz",
  "index_name": "qa",
  "demo": "/data/local/dsi_crea/dsi_crea/Daten/participants.tsv",
  "variable_list": "0,4",
  "voi": 0,
  "effect_size": 0.2,
  "length_threshold": 30.0,
  "fdr_threshold": 0.5,
  "permutation": 10000,
  "thread_count": 8,
  "exclude_cb": 0,
  "normalize_iso": 1
}
2025-12-04 22:46:22,746 - INFO - ================================================================================
2025-12-04 22:46:22,746 - INFO - 
================================================================================
2025-12-04 22:46:22,747 - INFO - Parameters: {
  "source": "/data/local/dsi_crea/dsi_crea/Daten/session1.qa.db.fz",
  "index_name": "qa",
  "demo": "/data/local/dsi_crea/dsi_crea/Daten/participants.tsv",
  "variable_list": "0,4",
  "voi": 0,
  "effect_size": 0.2,
  "length_threshold": 40.0,
  "fdr_threshold": 0.5,
  "permutation": 10000,
  "thread_count": 8,
  "exclude_cb": 0,
  "normalize_iso": 1
}
2025-12-04 22:46:22,747 - INFO - Command: /usr/bin/xvfb-run -a /data/local/software/dsi-studio/dsi_studio --action=cnt --source=/data/local/dsi_crea/dsi_crea/Daten/session1.qa.db.fz --demo=/data/local/dsi_crea/dsi_crea/Daten/participants.tsv --variable_list=0,4 --voi=0 --index_name=qa --effect_size=0.2 --length_threshold=30.0 --fdr_threshold=0.5 --permutation=10000 --thread_count=8 --exclude_cb=0 --normalize_iso=1 --output=/data/local/software/dsistuido/connectometry_results/qa_0.2_30_10000/qa_0.2_30_10000
2025-12-04 22:46:22,747 - INFO - Parameters: {
  "source": "/data/local/dsi_crea/dsi_crea/Daten/session1.qa.db.fz",
  "index_name": "qa",
  "demo": "/data/local/dsi_crea/dsi_crea/Daten/participants.tsv",
  "variable_list": "0,4",
  "voi": 0,
  "effect_size": 0.2,
  "length_threshold": 20.0,
  "fdr_threshold": 0.5,
  "permutation": 10000,
  "thread_count": 8,
  "exclude_cb": 0,
  "normalize_iso": 1
}
2025-12-04 22:46:22,748 - INFO - Analysis 4/25: qa_0.2_50_10000
2025-12-04 22:46:22,748 - INFO - Command: /usr/bin/xvfb-run -a /data/local/software/dsi-studio/dsi_studio --action=cnt --source=/data/local/dsi_crea/dsi_crea/Daten/session1.qa.db.fz --demo=/data/local/dsi_crea/dsi_crea/Daten/participants.tsv --variable_list=0,4 --voi=0 --index_name=qa --effect_size=0.2 --length_threshold=40.0 --fdr_threshold=0.5 --permutation=10000 --thread_count=8 --exclude_cb=0 --normalize_iso=1 --output=/data/local/software/dsistuido/connectometry_results/qa_0.2_40_10000/qa_0.2_40_10000
2025-12-04 22:46:22,748 - INFO - ================================================================================

2025-12-04 22:46:22,748 - INFO - Command: /usr/bin/xvfb-run -a /data/local/software/dsi-studio/dsi_studio --action=cnt --source=/data/local/dsi_crea/dsi_crea/Daten/session1.qa.db.fz --demo=/data/local/dsi_crea/dsi_crea/Daten/participants.tsv --variable_list=0,4 --voi=0 --index_name=qa --effect_size=0.2 --length_threshold=20.0 --fdr_threshold=0.5 --permutation=10000 --thread_count=8 --exclude_cb=0 --normalize_iso=1 --output=/data/local/software/dsistuido/connectometry_results/qa_0.2_20_10000/qa_0.2_20_10000
2025-12-04 22:46:22,749 - INFO - ================================================================================
2025-12-04 22:46:22,749 - INFO - ================================================================================

2025-12-04 22:46:22,749 - INFO - ================================================================================

2025-12-04 22:46:22,750 - INFO - Parameters: {
  "source": "/data/local/dsi_crea/dsi_crea/Daten/session1.qa.db.fz",
  "index_name": "qa",
  "demo": "/data/local/dsi_crea/dsi_crea/Daten/participants.tsv",
  "variable_list": "0,4",
  "voi": 0,
  "effect_size": 0.2,
  "length_threshold": 50.0,
  "fdr_threshold": 0.5,
  "permutation": 10000,
  "thread_count": 8,
  "exclude_cb": 0,
  "normalize_iso": 1
}
2025-12-04 22:46:22,753 - INFO - Command: /usr/bin/xvfb-run -a /data/local/software/dsi-studio/dsi_studio --action=cnt --source=/data/local/dsi_crea/dsi_crea/Daten/session1.qa.db.fz --demo=/data/local/dsi_crea/dsi_crea/Daten/participants.tsv --variable_list=0,4 --voi=0 --index_name=qa --effect_size=0.2 --length_threshold=50.0 --fdr_threshold=0.5 --permutation=10000 --thread_count=8 --exclude_cb=0 --normalize_iso=1 --output=/data/local/software/dsistuido/connectometry_results/qa_0.2_50_10000/qa_0.2_50_10000
2025-12-04 22:46:22,754 - INFO - ================================================================================

2025-12-04 23:52:07,945 - ERROR - ✗ Analysis failed with return code 139
2025-12-04 23:52:07,946 - ERROR - STDERR: 
2025-12-04 23:52:07,946 - INFO - 
================================================================================
2025-12-04 23:52:07,947 - INFO - Analysis 5/25: qa_0.2_60_10000
2025-12-04 23:52:07,947 - INFO - ================================================================================
2025-12-04 23:52:07,947 - INFO - Parameters: {
  "source": "/data/local/dsi_crea/dsi_crea/Daten/session1.qa.db.fz",
  "index_name": "qa",
  "demo": "/data/local/dsi_crea/dsi_crea/Daten/participants.tsv",
  "variable_list": "0,4",
  "voi": 0,
  "effect_size": 0.2,
  "length_threshold": 60.0,
  "fdr_threshold": 0.5,
  "permutation": 10000,
  "thread_count": 8,
  "exclude_cb": 0,
  "normalize_iso": 1
}
2025-12-04 23:52:07,947 - INFO - Command: /usr/bin/xvfb-run -a /data/local/software/dsi-studio/dsi_studio --action=cnt --source=/data/local/dsi_crea/dsi_crea/Daten/session1.qa.db.fz --demo=/data/local/dsi_crea/dsi_crea/Daten/participants.tsv --variable_list=0,4 --voi=0 --index_name=qa --effect_size=0.2 --length_threshold=60.0 --fdr_threshold=0.5 --permutation=10000 --thread_count=8 --exclude_cb=0 --normalize_iso=1 --output=/data/local/software/dsistuido/connectometry_results/qa_0.2_60_10000/qa_0.2_60_10000
2025-12-04 23:52:07,947 - INFO - ================================================================================

2025-12-04 23:52:14,729 - ERROR - ✗ Analysis failed with return code 139
2025-12-04 23:52:14,729 - ERROR - STDERR: 
2025-12-04 23:52:14,729 - INFO - 
================================================================================
2025-12-04 23:52:14,730 - INFO - Analysis 6/25: qa_0.25_20_10000
2025-12-04 23:52:14,730 - INFO - ================================================================================
2025-12-04 23:52:14,730 - INFO - Parameters: {
  "source": "/data/local/dsi_crea/dsi_crea/Daten/session1.qa.db.fz",
  "index_name": "qa",
  "demo": "/data/local/dsi_crea/dsi_crea/Daten/participants.tsv",
  "variable_list": "0,4",
  "voi": 0,
  "effect_size": 0.25,
  "length_threshold": 20.0,
  "fdr_threshold": 0.5,
  "permutation": 10000,
  "thread_count": 8,
  "exclude_cb": 0,
  "normalize_iso": 1
}
2025-12-04 23:52:14,730 - INFO - Command: /usr/bin/xvfb-run -a /data/local/software/dsi-studio/dsi_studio --action=cnt --source=/data/local/dsi_crea/dsi_crea/Daten/session1.qa.db.fz --demo=/data/local/dsi_crea/dsi_crea/Daten/participants.tsv --variable_list=0,4 --voi=0 --index_name=qa --effect_size=0.25 --length_threshold=20.0 --fdr_threshold=0.5 --permutation=10000 --thread_count=8 --exclude_cb=0 --normalize_iso=1 --output=/data/local/software/dsistuido/connectometry_results/qa_0.25_20_10000/qa_0.25_20_10000
2025-12-04 23:52:14,730 - INFO - ================================================================================

2025-12-04 23:52:30,755 - ERROR - ✗ Analysis failed with return code 139
2025-12-04 23:52:30,755 - ERROR - STDERR: 
2025-12-04 23:52:30,756 - INFO - 
================================================================================
2025-12-04 23:52:30,756 - INFO - Analysis 7/25: qa_0.25_30_10000
2025-12-04 23:52:30,756 - INFO - ================================================================================
2025-12-04 23:52:30,756 - INFO - Parameters: {
  "source": "/data/local/dsi_crea/dsi_crea/Daten/session1.qa.db.fz",
  "index_name": "qa",
  "demo": "/data/local/dsi_crea/dsi_crea/Daten/participants.tsv",
  "variable_list": "0,4",
  "voi": 0,
  "effect_size": 0.25,
  "length_threshold": 30.0,
  "fdr_threshold": 0.5,
  "permutation": 10000,
  "thread_count": 8,
  "exclude_cb": 0,
  "normalize_iso": 1
}
2025-12-04 23:52:30,756 - INFO - Command: /usr/bin/xvfb-run -a /data/local/software/dsi-studio/dsi_studio --action=cnt --source=/data/local/dsi_crea/dsi_crea/Daten/session1.qa.db.fz --demo=/data/local/dsi_crea/dsi_crea/Daten/participants.tsv --variable_list=0,4 --voi=0 --index_name=qa --effect_size=0.25 --length_threshold=30.0 --fdr_threshold=0.5 --permutation=10000 --thread_count=8 --exclude_cb=0 --normalize_iso=1 --output=/data/local/software/dsistuido/connectometry_results/qa_0.25_30_10000/qa_0.25_30_10000
2025-12-04 23:52:30,756 - INFO - ================================================================================

2025-12-04 23:54:21,093 - ERROR - ✗ Analysis failed with return code 139
2025-12-04 23:54:21,093 - ERROR - STDERR: 
2025-12-04 23:54:21,094 - INFO - 
================================================================================
2025-12-04 23:54:21,094 - INFO - Analysis 8/25: qa_0.25_40_10000
2025-12-04 23:54:21,094 - INFO - ================================================================================
2025-12-04 23:54:21,094 - INFO - Parameters: {
  "source": "/data/local/dsi_crea/dsi_crea/Daten/session1.qa.db.fz",
  "index_name": "qa",
  "demo": "/data/local/dsi_crea/dsi_crea/Daten/participants.tsv",
  "variable_list": "0,4",
  "voi": 0,
  "effect_size": 0.25,
  "length_threshold": 40.0,
  "fdr_threshold": 0.5,
  "permutation": 10000,
  "thread_count": 8,
  "exclude_cb": 0,
  "normalize_iso": 1
}
2025-12-04 23:54:21,094 - INFO - Command: /usr/bin/xvfb-run -a /data/local/software/dsi-studio/dsi_studio --action=cnt --source=/data/local/dsi_crea/dsi_crea/Daten/session1.qa.db.fz --demo=/data/local/dsi_crea/dsi_crea/Daten/participants.tsv --variable_list=0,4 --voi=0 --index_name=qa --effect_size=0.25 --length_threshold=40.0 --fdr_threshold=0.5 --permutation=10000 --thread_count=8 --exclude_cb=0 --normalize_iso=1 --output=/data/local/software/dsistuido/connectometry_results/qa_0.25_40_10000/qa_0.25_40_10000
2025-12-04 23:54:21,094 - INFO - ================================================================================

2025-12-05 00:56:18,345 - INFO - ✓ Analysis completed successfully in 3850.40s
2025-12-05 00:56:18,346 - INFO -   -> Found INCREASED connectivity findings
2025-12-05 00:56:18,348 - INFO - 
================================================================================
2025-12-05 00:56:18,348 - INFO - Analysis 9/25: qa_0.25_50_10000
2025-12-05 00:56:18,348 - INFO - ================================================================================
2025-12-05 00:56:18,349 - INFO - Parameters: {
  "source": "/data/local/dsi_crea/dsi_crea/Daten/session1.qa.db.fz",
  "index_name": "qa",
  "demo": "/data/local/dsi_crea/dsi_crea/Daten/participants.tsv",
  "variable_list": "0,4",
  "voi": 0,
  "effect_size": 0.25,
  "length_threshold": 50.0,
  "fdr_threshold": 0.5,
  "permutation": 10000,
  "thread_count": 8,
  "exclude_cb": 0,
  "normalize_iso": 1
}
2025-12-05 00:56:18,349 - INFO - Command: /usr/bin/xvfb-run -a /data/local/software/dsi-studio/dsi_studio --action=cnt --source=/data/local/dsi_crea/dsi_crea/Daten/session1.qa.db.fz --demo=/data/local/dsi_crea/dsi_crea/Daten/participants.tsv --variable_list=0,4 --voi=0 --index_name=qa --effect_size=0.25 --length_threshold=50.0 --fdr_threshold=0.5 --permutation=10000 --thread_count=8 --exclude_cb=0 --normalize_iso=1 --output=/data/local/software/dsistuido/connectometry_results/qa_0.25_50_10000/qa_0.25_50_10000
2025-12-05 00:56:18,349 - INFO - ================================================================================

2025-12-05 00:56:32,049 - INFO - ✓ Analysis completed successfully in 3857.32s
2025-12-05 00:56:32,050 - INFO -   -> Found INCREASED connectivity findings
2025-12-05 00:56:32,051 - INFO - 
================================================================================
2025-12-05 00:56:32,051 - INFO - Analysis 10/25: qa_0.25_60_10000
2025-12-05 00:56:32,051 - INFO - ================================================================================
2025-12-05 00:56:32,051 - INFO - Parameters: {
  "source": "/data/local/dsi_crea/dsi_crea/Daten/session1.qa.db.fz",
  "index_name": "qa",
  "demo": "/data/local/dsi_crea/dsi_crea/Daten/participants.tsv",
  "variable_list": "0,4",
  "voi": 0,
  "effect_size": 0.25,
  "length_threshold": 60.0,
  "fdr_threshold": 0.5,
  "permutation": 10000,
  "thread_count": 8,
  "exclude_cb": 0,
  "normalize_iso": 1
}
2025-12-05 00:56:32,051 - INFO - Command: /usr/bin/xvfb-run -a /data/local/software/dsi-studio/dsi_studio --action=cnt --source=/data/local/dsi_crea/dsi_crea/Daten/session1.qa.db.fz --demo=/data/local/dsi_crea/dsi_crea/Daten/participants.tsv --variable_list=0,4 --voi=0 --index_name=qa --effect_size=0.25 --length_threshold=60.0 --fdr_threshold=0.5 --permutation=10000 --thread_count=8 --exclude_cb=0 --normalize_iso=1 --output=/data/local/software/dsistuido/connectometry_results/qa_0.25_60_10000/qa_0.25_60_10000
2025-12-05 00:56:32,051 - INFO - ================================================================================

2025-12-05 00:56:33,101 - INFO - ✓ Analysis completed successfully in 3842.34s
2025-12-05 00:56:33,101 - INFO -   -> Found INCREASED connectivity findings
2025-12-05 00:56:33,102 - INFO - 
================================================================================
2025-12-05 00:56:33,102 - INFO - Analysis 11/25: qa_0.3_20_10000
2025-12-05 00:56:33,102 - INFO - ================================================================================
2025-12-05 00:56:33,102 - INFO - Parameters: {
  "source": "/data/local/dsi_crea/dsi_crea/Daten/session1.qa.db.fz",
  "index_name": "qa",
  "demo": "/data/local/dsi_crea/dsi_crea/Daten/participants.tsv",
  "variable_list": "0,4",
  "voi": 0,
  "effect_size": 0.3,
  "length_threshold": 20.0,
  "fdr_threshold": 0.5,
  "permutation": 10000,
  "thread_count": 8,
  "exclude_cb": 0,
  "normalize_iso": 1
}
2025-12-05 00:56:33,102 - INFO - Command: /usr/bin/xvfb-run -a /data/local/software/dsi-studio/dsi_studio --action=cnt --source=/data/local/dsi_crea/dsi_crea/Daten/session1.qa.db.fz --demo=/data/local/dsi_crea/dsi_crea/Daten/participants.tsv --variable_list=0,4 --voi=0 --index_name=qa --effect_size=0.3 --length_threshold=20.0 --fdr_threshold=0.5 --permutation=10000 --thread_count=8 --exclude_cb=0 --normalize_iso=1 --output=/data/local/software/dsistuido/connectometry_results/qa_0.3_20_10000/qa_0.3_20_10000
2025-12-05 00:56:33,102 - INFO - ================================================================================

2025-12-05 00:57:31,041 - INFO - ✓ Analysis completed successfully in 3789.95s
2025-12-05 00:57:31,042 - INFO -   -> Found INCREASED connectivity findings
2025-12-05 00:57:31,043 - INFO - 
================================================================================
2025-12-05 00:57:31,043 - INFO - Analysis 12/25: qa_0.3_30_10000
2025-12-05 00:57:31,043 - INFO - ================================================================================
2025-12-05 00:57:31,043 - INFO - Parameters: {
  "source": "/data/local/dsi_crea/dsi_crea/Daten/session1.qa.db.fz",
  "index_name": "qa",
  "demo": "/data/local/dsi_crea/dsi_crea/Daten/participants.tsv",
  "variable_list": "0,4",
  "voi": 0,
  "effect_size": 0.3,
  "length_threshold": 30.0,
  "fdr_threshold": 0.5,
  "permutation": 10000,
  "thread_count": 8,
  "exclude_cb": 0,
  "normalize_iso": 1
}
2025-12-05 00:57:31,043 - INFO - Command: /usr/bin/xvfb-run -a /data/local/software/dsi-studio/dsi_studio --action=cnt --source=/data/local/dsi_crea/dsi_crea/Daten/session1.qa.db.fz --demo=/data/local/dsi_crea/dsi_crea/Daten/participants.tsv --variable_list=0,4 --voi=0 --index_name=qa --effect_size=0.3 --length_threshold=30.0 --fdr_threshold=0.5 --permutation=10000 --thread_count=8 --exclude_cb=0 --normalize_iso=1 --output=/data/local/software/dsistuido/connectometry_results/qa_0.3_30_10000/qa_0.3_30_10000
2025-12-05 00:57:31,043 - INFO - ================================================================================

2025-12-05 01:59:14,754 - INFO - ✓ Analysis completed successfully in 3776.41s
2025-12-05 01:59:14,756 - INFO - 
================================================================================
2025-12-05 01:59:14,756 - INFO - Analysis 13/25: qa_0.3_40_10000
2025-12-05 01:59:14,756 - INFO - ================================================================================
2025-12-05 01:59:14,757 - INFO - Parameters: {
  "source": "/data/local/dsi_crea/dsi_crea/Daten/session1.qa.db.fz",
  "index_name": "qa",
  "demo": "/data/local/dsi_crea/dsi_crea/Daten/participants.tsv",
  "variable_list": "0,4",
  "voi": 0,
  "effect_size": 0.3,
  "length_threshold": 40.0,
  "fdr_threshold": 0.5,
  "permutation": 10000,
  "thread_count": 8,
  "exclude_cb": 0,
  "normalize_iso": 1
}
2025-12-05 01:59:14,757 - INFO - Command: /usr/bin/xvfb-run -a /data/local/software/dsi-studio/dsi_studio --action=cnt --source=/data/local/dsi_crea/dsi_crea/Daten/session1.qa.db.fz --demo=/data/local/dsi_crea/dsi_crea/Daten/participants.tsv --variable_list=0,4 --voi=0 --index_name=qa --effect_size=0.3 --length_threshold=40.0 --fdr_threshold=0.5 --permutation=10000 --thread_count=8 --exclude_cb=0 --normalize_iso=1 --output=/data/local/software/dsistuido/connectometry_results/qa_0.3_40_10000/qa_0.3_40_10000
2025-12-05 01:59:14,757 - INFO - ================================================================================

2025-12-05 01:59:26,417 - INFO - ✓ Analysis completed successfully in 3774.37s
2025-12-05 01:59:26,418 - INFO - 
================================================================================
2025-12-05 01:59:26,418 - INFO - Analysis 14/25: qa_0.3_50_10000
2025-12-05 01:59:26,418 - INFO - ================================================================================
2025-12-05 01:59:26,418 - INFO - Parameters: {
  "source": "/data/local/dsi_crea/dsi_crea/Daten/session1.qa.db.fz",
  "index_name": "qa",
  "demo": "/data/local/dsi_crea/dsi_crea/Daten/participants.tsv",
  "variable_list": "0,4",
  "voi": 0,
  "effect_size": 0.3,
  "length_threshold": 50.0,
  "fdr_threshold": 0.5,
  "permutation": 10000,
  "thread_count": 8,
  "exclude_cb": 0,
  "normalize_iso": 1
}
2025-12-05 01:59:26,418 - INFO - Command: /usr/bin/xvfb-run -a /data/local/software/dsi-studio/dsi_studio --action=cnt --source=/data/local/dsi_crea/dsi_crea/Daten/session1.qa.db.fz --demo=/data/local/dsi_crea/dsi_crea/Daten/participants.tsv --variable_list=0,4 --voi=0 --index_name=qa --effect_size=0.3 --length_threshold=50.0 --fdr_threshold=0.5 --permutation=10000 --thread_count=8 --exclude_cb=0 --normalize_iso=1 --output=/data/local/software/dsistuido/connectometry_results/qa_0.3_50_10000/qa_0.3_50_10000
2025-12-05 01:59:26,418 - INFO - ================================================================================

2025-12-05 01:59:29,789 - INFO - ✓ Analysis completed successfully in 3776.69s
2025-12-05 01:59:29,790 - INFO -   -> Found INCREASED connectivity findings
2025-12-05 01:59:29,790 - INFO - 
================================================================================
2025-12-05 01:59:29,790 - INFO - Analysis 15/25: qa_0.3_60_10000
2025-12-05 01:59:29,790 - INFO - ================================================================================
2025-12-05 01:59:29,790 - INFO - Parameters: {
  "source": "/data/local/dsi_crea/dsi_crea/Daten/session1.qa.db.fz",
  "index_name": "qa",
  "demo": "/data/local/dsi_crea/dsi_crea/Daten/participants.tsv",
  "variable_list": "0,4",
  "voi": 0,
  "effect_size": 0.3,
  "length_threshold": 60.0,
  "fdr_threshold": 0.5,
  "permutation": 10000,
  "thread_count": 8,
  "exclude_cb": 0,
  "normalize_iso": 1
}
2025-12-05 01:59:29,790 - INFO - Command: /usr/bin/xvfb-run -a /data/local/software/dsi-studio/dsi_studio --action=cnt --source=/data/local/dsi_crea/dsi_crea/Daten/session1.qa.db.fz --demo=/data/local/dsi_crea/dsi_crea/Daten/participants.tsv --variable_list=0,4 --voi=0 --index_name=qa --effect_size=0.3 --length_threshold=60.0 --fdr_threshold=0.5 --permutation=10000 --thread_count=8 --exclude_cb=0 --normalize_iso=1 --output=/data/local/software/dsistuido/connectometry_results/qa_0.3_60_10000/qa_0.3_60_10000
2025-12-05 01:59:29,790 - INFO - ================================================================================

2025-12-05 02:00:18,281 - INFO - ✓ Analysis completed successfully in 3767.24s
2025-12-05 02:00:18,282 - INFO - 
================================================================================
2025-12-05 02:00:18,282 - INFO - Analysis 16/25: qa_0.35_20_10000
2025-12-05 02:00:18,282 - INFO - ================================================================================
2025-12-05 02:00:18,283 - INFO - Parameters: {
  "source": "/data/local/dsi_crea/dsi_crea/Daten/session1.qa.db.fz",
  "index_name": "qa",
  "demo": "/data/local/dsi_crea/dsi_crea/Daten/participants.tsv",
  "variable_list": "0,4",
  "voi": 0,
  "effect_size": 0.35,
  "length_threshold": 20.0,
  "fdr_threshold": 0.5,
  "permutation": 10000,
  "thread_count": 8,
  "exclude_cb": 0,
  "normalize_iso": 1
}
2025-12-05 02:00:18,283 - INFO - Command: /usr/bin/xvfb-run -a /data/local/software/dsi-studio/dsi_studio --action=cnt --source=/data/local/dsi_crea/dsi_crea/Daten/session1.qa.db.fz --demo=/data/local/dsi_crea/dsi_crea/Daten/participants.tsv --variable_list=0,4 --voi=0 --index_name=qa --effect_size=0.35 --length_threshold=20.0 --fdr_threshold=0.5 --permutation=10000 --thread_count=8 --exclude_cb=0 --normalize_iso=1 --output=/data/local/software/dsistuido/connectometry_results/qa_0.35_20_10000/qa_0.35_20_10000
2025-12-05 02:00:18,283 - INFO - ================================================================================

2025-12-05 03:01:51,711 - INFO - ✓ Analysis completed successfully in 3756.95s
2025-12-05 03:01:51,713 - INFO - 
================================================================================
2025-12-05 03:01:51,714 - INFO - Analysis 17/25: qa_0.35_30_10000
2025-12-05 03:01:51,714 - INFO - ================================================================================
2025-12-05 03:01:51,714 - INFO - Parameters: {
  "source": "/data/local/dsi_crea/dsi_crea/Daten/session1.qa.db.fz",
  "index_name": "qa",
  "demo": "/data/local/dsi_crea/dsi_crea/Daten/participants.tsv",
  "variable_list": "0,4",
  "voi": 0,
  "effect_size": 0.35,
  "length_threshold": 30.0,
  "fdr_threshold": 0.5,
  "permutation": 10000,
  "thread_count": 8,
  "exclude_cb": 0,
  "normalize_iso": 1
}
2025-12-05 03:01:51,714 - INFO - Command: /usr/bin/xvfb-run -a /data/local/software/dsi-studio/dsi_studio --action=cnt --source=/data/local/dsi_crea/dsi_crea/Daten/session1.qa.db.fz --demo=/data/local/dsi_crea/dsi_crea/Daten/participants.tsv --variable_list=0,4 --voi=0 --index_name=qa --effect_size=0.35 --length_threshold=30.0 --fdr_threshold=0.5 --permutation=10000 --thread_count=8 --exclude_cb=0 --normalize_iso=1 --output=/data/local/software/dsistuido/connectometry_results/qa_0.35_30_10000/qa_0.35_30_10000
2025-12-05 03:01:51,714 - INFO - ================================================================================

2025-12-05 03:02:06,473 - INFO - ✓ Analysis completed successfully in 3756.68s
2025-12-05 03:02:06,474 - INFO - 
================================================================================
2025-12-05 03:02:06,475 - INFO - Analysis 18/25: qa_0.35_40_10000
2025-12-05 03:02:06,475 - INFO - ================================================================================
2025-12-05 03:02:06,475 - INFO - Parameters: {
  "source": "/data/local/dsi_crea/dsi_crea/Daten/session1.qa.db.fz",
  "index_name": "qa",
  "demo": "/data/local/dsi_crea/dsi_crea/Daten/participants.tsv",
  "variable_list": "0,4",
  "voi": 0,
  "effect_size": 0.35,
  "length_threshold": 40.0,
  "fdr_threshold": 0.5,
  "permutation": 10000,
  "thread_count": 8,
  "exclude_cb": 0,
  "normalize_iso": 1
}
2025-12-05 03:02:06,475 - INFO - Command: /usr/bin/xvfb-run -a /data/local/software/dsi-studio/dsi_studio --action=cnt --source=/data/local/dsi_crea/dsi_crea/Daten/session1.qa.db.fz --demo=/data/local/dsi_crea/dsi_crea/Daten/participants.tsv --variable_list=0,4 --voi=0 --index_name=qa --effect_size=0.35 --length_threshold=40.0 --fdr_threshold=0.5 --permutation=10000 --thread_count=8 --exclude_cb=0 --normalize_iso=1 --output=/data/local/software/dsistuido/connectometry_results/qa_0.35_40_10000/qa_0.35_40_10000
2025-12-05 03:02:06,475 - INFO - ================================================================================

2025-12-05 03:02:09,109 - INFO - ✓ Analysis completed successfully in 3762.69s
2025-12-05 03:02:09,110 - INFO - 
================================================================================
2025-12-05 03:02:09,110 - INFO - Analysis 19/25: qa_0.35_50_10000
2025-12-05 03:02:09,110 - INFO - ================================================================================
2025-12-05 03:02:09,110 - INFO - Parameters: {
  "source": "/data/local/dsi_crea/dsi_crea/Daten/session1.qa.db.fz",
  "index_name": "qa",
  "demo": "/data/local/dsi_crea/dsi_crea/Daten/participants.tsv",
  "variable_list": "0,4",
  "voi": 0,
  "effect_size": 0.35,
  "length_threshold": 50.0,
  "fdr_threshold": 0.5,
  "permutation": 10000,
  "thread_count": 8,
  "exclude_cb": 0,
  "normalize_iso": 1
}
2025-12-05 03:02:09,110 - INFO - Command: /usr/bin/xvfb-run -a /data/local/software/dsi-studio/dsi_studio --action=cnt --source=/data/local/dsi_crea/dsi_crea/Daten/session1.qa.db.fz --demo=/data/local/dsi_crea/dsi_crea/Daten/participants.tsv --variable_list=0,4 --voi=0 --index_name=qa --effect_size=0.35 --length_threshold=50.0 --fdr_threshold=0.5 --permutation=10000 --thread_count=8 --exclude_cb=0 --normalize_iso=1 --output=/data/local/software/dsistuido/connectometry_results/qa_0.35_50_10000/qa_0.35_50_10000
2025-12-05 03:02:09,110 - INFO - ================================================================================

2025-12-05 03:02:54,751 - INFO - ✓ Analysis completed successfully in 3756.47s
2025-12-05 03:02:54,752 - INFO - 
================================================================================
2025-12-05 03:02:54,752 - INFO - Analysis 20/25: qa_0.35_60_10000
2025-12-05 03:02:54,752 - INFO - ================================================================================
2025-12-05 03:02:54,752 - INFO - Parameters: {
  "source": "/data/local/dsi_crea/dsi_crea/Daten/session1.qa.db.fz",
  "index_name": "qa",
  "demo": "/data/local/dsi_crea/dsi_crea/Daten/participants.tsv",
  "variable_list": "0,4",
  "voi": 0,
  "effect_size": 0.35,
  "length_threshold": 60.0,
  "fdr_threshold": 0.5,
  "permutation": 10000,
  "thread_count": 8,
  "exclude_cb": 0,
  "normalize_iso": 1
}
2025-12-05 03:02:54,752 - INFO - Command: /usr/bin/xvfb-run -a /data/local/software/dsi-studio/dsi_studio --action=cnt --source=/data/local/dsi_crea/dsi_crea/Daten/session1.qa.db.fz --demo=/data/local/dsi_crea/dsi_crea/Daten/participants.tsv --variable_list=0,4 --voi=0 --index_name=qa --effect_size=0.35 --length_threshold=60.0 --fdr_threshold=0.5 --permutation=10000 --thread_count=8 --exclude_cb=0 --normalize_iso=1 --output=/data/local/software/dsistuido/connectometry_results/qa_0.35_60_10000/qa_0.35_60_10000
2025-12-05 03:02:54,752 - INFO - ================================================================================

2025-12-05 04:04:12,935 - INFO - ✓ Analysis completed successfully in 3741.22s
2025-12-05 04:04:12,956 - INFO - 
================================================================================
2025-12-05 04:04:12,956 - INFO - Analysis 21/25: qa_0.4_20_10000
2025-12-05 04:04:12,956 - INFO - ================================================================================
2025-12-05 04:04:12,956 - INFO - Parameters: {
  "source": "/data/local/dsi_crea/dsi_crea/Daten/session1.qa.db.fz",
  "index_name": "qa",
  "demo": "/data/local/dsi_crea/dsi_crea/Daten/participants.tsv",
  "variable_list": "0,4",
  "voi": 0,
  "effect_size": 0.4,
  "length_threshold": 20.0,
  "fdr_threshold": 0.5,
  "permutation": 10000,
  "thread_count": 8,
  "exclude_cb": 0,
  "normalize_iso": 1
}
2025-12-05 04:04:12,956 - INFO - Command: /usr/bin/xvfb-run -a /data/local/software/dsi-studio/dsi_studio --action=cnt --source=/data/local/dsi_crea/dsi_crea/Daten/session1.qa.db.fz --demo=/data/local/dsi_crea/dsi_crea/Daten/participants.tsv --variable_list=0,4 --voi=0 --index_name=qa --effect_size=0.4 --length_threshold=20.0 --fdr_threshold=0.5 --permutation=10000 --thread_count=8 --exclude_cb=0 --normalize_iso=1 --output=/data/local/software/dsistuido/connectometry_results/qa_0.4_20_10000/qa_0.4_20_10000
2025-12-05 04:04:12,956 - INFO - ================================================================================

2025-12-05 04:04:47,117 - INFO - ✓ Analysis completed successfully in 3760.64s
2025-12-05 04:04:47,120 - INFO - 
================================================================================
2025-12-05 04:04:47,120 - INFO - Analysis 22/25: qa_0.4_30_10000
2025-12-05 04:04:47,120 - INFO - ================================================================================
2025-12-05 04:04:47,120 - INFO - Parameters: {
  "source": "/data/local/dsi_crea/dsi_crea/Daten/session1.qa.db.fz",
  "index_name": "qa",
  "demo": "/data/local/dsi_crea/dsi_crea/Daten/participants.tsv",
  "variable_list": "0,4",
  "voi": 0,
  "effect_size": 0.4,
  "length_threshold": 30.0,
  "fdr_threshold": 0.5,
  "permutation": 10000,
  "thread_count": 8,
  "exclude_cb": 0,
  "normalize_iso": 1
}
2025-12-05 04:04:47,120 - INFO - Command: /usr/bin/xvfb-run -a /data/local/software/dsi-studio/dsi_studio --action=cnt --source=/data/local/dsi_crea/dsi_crea/Daten/session1.qa.db.fz --demo=/data/local/dsi_crea/dsi_crea/Daten/participants.tsv --variable_list=0,4 --voi=0 --index_name=qa --effect_size=0.4 --length_threshold=30.0 --fdr_threshold=0.5 --permutation=10000 --thread_count=8 --exclude_cb=0 --normalize_iso=1 --output=/data/local/software/dsistuido/connectometry_results/qa_0.4_30_10000/qa_0.4_30_10000
2025-12-05 04:04:47,121 - INFO - ================================================================================

2025-12-05 04:04:48,133 - INFO - ✓ Analysis completed successfully in 3759.02s
2025-12-05 04:04:48,135 - INFO - 
================================================================================
2025-12-05 04:04:48,136 - INFO - Analysis 23/25: qa_0.4_40_10000
2025-12-05 04:04:48,136 - INFO - ================================================================================
2025-12-05 04:04:48,136 - INFO - Parameters: {
  "source": "/data/local/dsi_crea/dsi_crea/Daten/session1.qa.db.fz",
  "index_name": "qa",
  "demo": "/data/local/dsi_crea/dsi_crea/Daten/participants.tsv",
  "variable_list": "0,4",
  "voi": 0,
  "effect_size": 0.4,
  "length_threshold": 40.0,
  "fdr_threshold": 0.5,
  "permutation": 10000,
  "thread_count": 8,
  "exclude_cb": 0,
  "normalize_iso": 1
}
2025-12-05 04:04:48,136 - INFO - Command: /usr/bin/xvfb-run -a /data/local/software/dsi-studio/dsi_studio --action=cnt --source=/data/local/dsi_crea/dsi_crea/Daten/session1.qa.db.fz --demo=/data/local/dsi_crea/dsi_crea/Daten/participants.tsv --variable_list=0,4 --voi=0 --index_name=qa --effect_size=0.4 --length_threshold=40.0 --fdr_threshold=0.5 --permutation=10000 --thread_count=8 --exclude_cb=0 --normalize_iso=1 --output=/data/local/software/dsistuido/connectometry_results/qa_0.4_40_10000/qa_0.4_40_10000
2025-12-05 04:04:48,136 - INFO - ================================================================================

2025-12-05 04:05:40,040 - INFO - ✓ Analysis completed successfully in 3765.29s
2025-12-05 04:05:40,041 - INFO - 
================================================================================
2025-12-05 04:05:40,042 - INFO - Analysis 24/25: qa_0.4_50_10000
2025-12-05 04:05:40,042 - INFO - ================================================================================
2025-12-05 04:05:40,042 - INFO - Parameters: {
  "source": "/data/local/dsi_crea/dsi_crea/Daten/session1.qa.db.fz",
  "index_name": "qa",
  "demo": "/data/local/dsi_crea/dsi_crea/Daten/participants.tsv",
  "variable_list": "0,4",
  "voi": 0,
  "effect_size": 0.4,
  "length_threshold": 50.0,
  "fdr_threshold": 0.5,
  "permutation": 10000,
  "thread_count": 8,
  "exclude_cb": 0,
  "normalize_iso": 1
}
2025-12-05 04:05:40,042 - INFO - Command: /usr/bin/xvfb-run -a /data/local/software/dsi-studio/dsi_studio --action=cnt --source=/data/local/dsi_crea/dsi_crea/Daten/session1.qa.db.fz --demo=/data/local/dsi_crea/dsi_crea/Daten/participants.tsv --variable_list=0,4 --voi=0 --index_name=qa --effect_size=0.4 --length_threshold=50.0 --fdr_threshold=0.5 --permutation=10000 --thread_count=8 --exclude_cb=0 --normalize_iso=1 --output=/data/local/software/dsistuido/connectometry_results/qa_0.4_50_10000/qa_0.4_50_10000
2025-12-05 04:05:40,042 - INFO - ================================================================================

2025-12-05 05:06:42,609 - INFO - ✓ Analysis completed successfully in 3749.65s
2025-12-05 05:06:42,610 - INFO - 
================================================================================
2025-12-05 05:06:42,611 - INFO - Analysis 25/25: qa_0.4_60_10000
2025-12-05 05:06:42,611 - INFO - ================================================================================
2025-12-05 05:06:42,611 - INFO - Parameters: {
  "source": "/data/local/dsi_crea/dsi_crea/Daten/session1.qa.db.fz",
  "index_name": "qa",
  "demo": "/data/local/dsi_crea/dsi_crea/Daten/participants.tsv",
  "variable_list": "0,4",
  "voi": 0,
  "effect_size": 0.4,
  "length_threshold": 60.0,
  "fdr_threshold": 0.5,
  "permutation": 10000,
  "thread_count": 8,
  "exclude_cb": 0,
  "normalize_iso": 1
}
2025-12-05 05:06:42,611 - INFO - Command: /usr/bin/xvfb-run -a /data/local/software/dsi-studio/dsi_studio --action=cnt --source=/data/local/dsi_crea/dsi_crea/Daten/session1.qa.db.fz --demo=/data/local/dsi_crea/dsi_crea/Daten/participants.tsv --variable_list=0,4 --voi=0 --index_name=qa --effect_size=0.4 --length_threshold=60.0 --fdr_threshold=0.5 --permutation=10000 --thread_count=8 --exclude_cb=0 --normalize_iso=1 --output=/data/local/software/dsistuido/connectometry_results/qa_0.4_60_10000/qa_0.4_60_10000
2025-12-05 05:06:42,611 - INFO - ================================================================================

2025-12-05 05:07:15,321 - INFO - ✓ Analysis completed successfully in 3747.19s
2025-12-05 05:07:17,665 - INFO - ✓ Analysis completed successfully in 3750.54s
2025-12-05 05:07:35,841 - INFO - ✓ Analysis completed successfully in 3715.80s
2025-12-05 05:23:53,362 - INFO - ✓ Analysis completed successfully in 1030.75s
2025-12-05 05:23:53,384 - INFO - 
================================================================================
2025-12-05 05:23:53,384 - INFO - SUMMARY
2025-12-05 05:23:53,384 - INFO - ================================================================================
2025-12-05 05:23:53,384 - INFO - Total analyses: 25
2025-12-05 05:23:53,385 - INFO - Successful: 21
2025-12-05 05:23:53,385 - INFO - Failed: 4
2025-12-05 05:23:53,386 - INFO - Timeout: 0
2025-12-05 05:23:53,386 - INFO - Error: 0
2025-12-05 05:23:53,386 - INFO - Summary saved to: /data/local/software/dsistuido/connectometry_results/analysis_summary_20251205_052353.json
2025-12-05 05:23:53,386 - INFO - ================================================================================

